{
  "schema_version": 3,
  "meta": {
    "id": "v3role",
    "name": "Doctor v3 Fixture",
    "version": "0.1.0",
    "author": "oclive-cli",
    "description": "Valid v3 blueprint for doctor tests",
    "personality": [0.5, 0.5, 0.5, 0.5, 0.5, 0.5, 0.5],
    "relations": {
      "friend": { "initial_favorability": 50.0, "favor_multiplier": 1.0 }
    },
    "default_relation": "friend",
    "scenes": ["default"]
  },
  "slot_registry": {
    "memory": { "type": "memory", "label": "Memory", "backend": "builtin", "position": 0 },
    "emotion": { "type": "emotion", "label": "Emotion", "backend": "builtin", "position": 0 },
    "complex_emotion": { "type": "complex_emotion", "label": "Complex emotion", "backend": "builtin", "position": 1 },
    "event": { "type": "event", "label": "Event", "backend": "builtin", "position": 0 },
    "prompt": { "type": "prompt", "label": "Prompt", "backend": "builtin", "position": 0 },
    "llm": { "type": "llm", "label": "LLM", "backend": "ollama", "position": 0 },
    "agent": { "type": "agent", "label": "Agent", "backend": "builtin", "position": 0 }
  },
  "runtime_config": {
    "interaction_mode": "immersive",
    "dual_core": { "enabled": false }
  }
}
